103,"Services by way of pure labour contracts of construction, erection, commissioning, or installation of original works pertaining to a single residential unit otherwise than as a part of a residential complex",Exempted
104,"Services of general insurance business provided under following schemes - (a) Hut Insurance Scheme; (b) Cattle Insurance under Swarnajaynti Gram Swarozgar Yojna (earlier known as Integrated Rural Development Programme); (c) Scheme for Insurance of Tribals; (d) Janata Personal Accident Policy and Gramin Accident Policy; (e) Group Personal Accident Policy for Self-Employed Women; (f) Agricultural Pumpset and Failed Well Insurance; (g) Premia collected on export credit insurance; (h) Weather Based Crop Insurance Scheme or the Modified National Agricultural Insurance Scheme, approved by the Government of India and implemented by the Ministry of Agriculture; (i) Jan Arogya Bima Policy; (j) National Agricultural Insurance Scheme (Rashtriya Krishi Bima Yojana); (k) Pilot Scheme on Seed Crop Insurance; (l) Central Sector Scheme on Cattle Insurance; (m) Universal Health Insurance Scheme; (n) Rashtriya Swasthya Bima Yojana; or (o) Coconut Palm Insurance Scheme; (p) Pradhan Mantri Suraksha BimaYojna; (q) Niramaya Health Insurance Scheme implemented by Trust constituted under the provisions of the National Trust for the Welfare of Persons with Autism, Cerebral Palsy, Mental Retardation and Multiple Disabilities Act, 1999 (44 of 1999); or (r) Any other insurance scheme of the State Government as may be notified by Government of India on the recommendation of GSTC.",Exempted
105,"Services of life insurance business provided under following schemes (a) Janashree Bima Yojana (JBY); or (b) Aam Aadmi Bima Yojana (AABY); (c) Life micro-insurance product as approved by the Insurance Regulatory and Development Authority, having maximum amount of cover of fifty thousand rupees; (d) Varishtha Pension BimaYojana; (e) Pradhan Mantri Jeevan JyotiBimaYojana; (f) Pradhan Mantri Jan DhanYogana; (g) Pradhan Mantri Vaya Vandan Yojana; and (h) Any other insurance scheme of the State Government as may be notified by Government of India on the recommendation of GSTC.",Exempted
106,Services by way of collection of contribution under Atal Pension Yojana (APY).,Exempted
107,Services by way of collection of contribution under any pension scheme of the State Governments.,Exempted
108,"Service of transportation of passengers, with or without accompanied belongings, by— (i) railways in a class other than— (A) first class; or (B) an air-conditioned coach; (ii) metro, monorail or tramway; (iii) inland waterways; (iv) public transport, other than predominantly for tourism purpose, in a vessel between places located in India; and (v) metered cabs or auto rickshaws (including E-rickshaws)",Exempted
109,"Services by a person by way of- (a) conduct of any religious ceremony; (b) renting of precincts of a religious place meant for general public, owned or managed by an entity registered as a charitable or religious trust under section 12AA of the Income-tax Act, 1961 (hereinafter referred to as the Income-tax Act), or a trust or an institution registered under sub clause (v) of clause (23C) of section 10 of the Income-tax Act or a body or an authority covered under clause (23BBA) of section 10 of the Income-tax Act: Provided that nothing contained in (b) of this exemption shall apply to,- (i) renting of rooms where charges are Rs 1000/- or more per day; (ii) renting of premises, community halls, kalyanmandapam or open area, etc where charges are Rs 10,000/- or more per day; (iii) renting of shops or other spaces for business or commerce where charges are Rs 10,000/-or more per month",Exempted
110,"Services by a hotel, inn, guest house, club or campsite, by whatever name called, for residential or lodging purposes, having declared tariff of a unit of accommodation less than one thousand rupees per day or equivalent",Exempted
111,"Services by way of transportation by rail or a vessel from one place in India to another of the following goods - (a) relief materials meant for victims of natural or man-made disasters, calamities, accidents or mishap; (b) defence or military equipments; (c) newspaper or magazines registered with the Registrar of Newspapers; (d) railway equipments or materials; (e) agricultural produce; (f) milk, salt and food grain including flours, pulses and rice; and (g) organic manure",Exempted
112,"Services provided by a goods transport agency, by way of transport in a goods carriage of,- (a) agricultural produce; (b) goods, where gross amount charged for the transportation of goods on a consignment transported in a single carriage does not exceed one thousand five hundred rupees; (c) goods, where gross amount charged for transportation of all such goods for a single consignee does not exceed rupees seven hundred fifty; (d) milk, salt and food grain including flour, pulses and rice (e) organic manure; (f) newspaper or magazines registered with the Registrar of Newspapers; (g) relief materials meant for victims of natural or man-made disasters, calamities, accidents or mishap; or (h) defence or military equipment’s",Exempted
113,Services by the following persons in respective capacities - (a) business facilitator or a business correspondent to a banking company with respect to accounts in its rural area branch; (b) any person as an intermediary to a business facilitator or a business correspondent with respect to services mentioned in clause (g); or (c) business facilitator or a business correspondent to an insurance company in a rural area,Exempted
114,"Carrying out an intermediate production process as job work in relation to cultivation of plants and rearing of all life forms of animals, except the rearing of horses, for food, fibre, fuel, raw material or other similar products or agricultural produce",Exempted
115,"Services by way of loading, unloading, packing, storage or warehousing of rice",Exempted
116,"Services by way of right to admission to, - (i) circus, dance, or theatrical performance including drama or ballet; (ii) award function, concert, pageant, musical performance or any sporting event other than a recognized sporting event; (iii) recognised sporting event; where the consideration for admission is not more than Rs 250 per person in (i), (ii) and (iii) above.",Exempted
117,"Services provided by Government or a local authority where the gross amount charged for such services does not exceed Rs.5000/. Provided that nothing contained in this entry shall apply to services S. No. 1 (i), (ii)and (iii) above: Provided further that in case where continuous supply of service, as defined in sub-section (33) of section2 of the CGST Act, 2017, is provided by the Government or a local authority, the exemption shall apply only where the gross amount charged for such service does not exceed Rs. 5000/- in a financial year; [This may be continued by way of an omnibus threshold exemption from payment of GST under section 9 (4) of CGST/SGST Act in respect of supplies upto Rs 10,000/-].",Exempted
118,"(i) Health care services by a clinical establishment, an authorised medical practitioner or para-medics; (ii) Services provided by way of transportation of a patient in an ambulance, other than those specified in (i) above;",Exempted
119,New Exemption: Services provided by the Goods and Services Tax Network (GSTN) to the Central Government or State Governments/Union Territories for implementation of Goods and Services Tax (GST),Exempted
120,Lottery run by State Governments,12% of face value of lottery ticket
121,Lottery authorized by State Governments,28% of face value of lottery ticket
122,"Pure services (excluding works contract service or other composite supplies involving supply of any goods) provided to Government, a local authority or a Governmental authority by way of any activity in relation to any function entrusted to a Panchayat under Article 243G of the Constitution or to any function entrusted to a Municipality under Article 243W of the Constitution",Exempted
123,Services provided to the Government under any insurance scheme for which total premium is paid by Government,Exempted
124,Services provided to the Government under any training programme for which total expenditure is borne by the Government,Exempted
125,"Services by way of job work in relation to – a) Textile yarns (other than man-made fibre/filament) & textile fabrics b) Cut and polished diamonds; precious and semi-precious stones, or plain and studded jewellery of gold and other precious metals, falling under chapter 71 of HSN c) Printing of books (including braille books), journals and periodicals d) Processing of leather",5% with Full ITC
126,Services by way of right to admission to exhibition of cinematographic films where the consideration for admission is Rs. 100 or less.,18% with Full ITC
127,"Job work services in respect of the textiles and textile products (including
MMF yarn, garments, made-ups, etc. falling in Chapters 50 to 63)",5%
128,"Services by way of printing of newspapers, books (including Braille books), journals and periodicals where only content is supplied by the publisher and the physical inputs including paper used for printing belongs to the printer",12% with full ITC
129,"Services by way of printing of newspapers, books (including Braille books), journals and periodicals using physical inputs owned by others (including an unregistered publisher/supplier)",5% with full ITC
130,"Works contract services provided to Government, local authority or governmental authority and in respect of post-harvest storage infrastructure for agricultural produce, mechanized food grain handling system",12% with full ITC
131,Margin/commission payable to Fair Price Shop Dealers by Central/ State Governments,Nil
132,Admission to planetarium,18% with full ITC
133,Rent-a-cab service,Allowed option of 12% GST with full ITC. 5% GST with no ITC will also continue